name,email,website,instagram,description
"Tai Pei Authentic Asian Cuisine",,"","","Japanese restaurant in Mumbai - High priority food establishment"
"AOI",,"","","Japanese restaurant at Devle Road Tara Juhu, Mumbai"
"Cashfree Payments","","","","Fintech company in Bengaluru, KA - Y Combinator startup"
"Reebee",,"","","http://reebee.com","Consumer startup in Kitchener, ON"
"toysstore.myshopify.com",,"https://toysstore.myshopify.com","","E-commerce store using default myshopify.com domain - needs custom domain"
"designshop.myshopify.com",,"https://designshop.myshopify.com","","B2B design store - needs brand storytelling and marketing setup"
"Clear",,"","","B2B fintech company in Bengaluru, KA"
"Sanitation and Health Rights in India (SHRI)",,"","","Healthcare startup focused on health rights in India"
