name,batch,industry,location,website_present,website,detail_url,description,description_length,logo,video,team_size,founders,github,score
Machine Zone,Winter 2008,"Consumer, Gaming","Machine Zone Palo Alto, CA",FALSE,,https://www.ycombinator.com/companies/machine-zone,Pioneers of mobile social gaming.,33,https://bookface-images.s3.amazonaws.com/small_logos/b8a10d341a50957a4b0c63d8f94e76f52fedfb9c.png,,,,,9
Mio,Winter 2016,"B2B, Engineering, Product and Design","Mio Austin, TX",FALSE,,https://www.ycombinator.com/companies/mio,Mio powers seamless communication between workplace chat apps.,62,https://bookface-images.s3.amazonaws.com/small_logos/d2e2140644182cb7ec4a70381a94543d8c8de82a.png,,,,,9
Newfront,Winter 2018,"Fintech, Insurance","Newfront San Francisco, CA",FALSE,,https://www.ycombinator.com/companies/newfront-insurance,Modern insurance brokerage.,27,https://bookface-images.s3.amazonaws.com/small_logos/6d7ef9c80d04b0eeccadce07af72fa59e617fb84.png,,,,https://github.com/newfront-insurance,8
Casetext,Summer 2013,"B2B, Legal","Casetext San Francisco, CA",TRUE,http://casetext.com,https://www.ycombinator.com/companies/casetext,We make the world's laws free and understandable.,49,,,,,https://github.com/casetext,7
DoorDash,Summer 2013,"Consumer, Food and Beverage",DoorDash,TRUE,http://doordash.com,https://www.ycombinator.com/companies/doordash,Restaurant delivery.,20,https://bookface-images.s3.amazonaws.com/small_logos/d13287c52acc96909f32342e85c26a33cfdac310.png,,,,,6
Coinbase,Summer 2012,"Fintech, Banking and Exchange","Coinbase San Francisco, CA",TRUE,https://www.coinbase.com,https://www.ycombinator.com/companies/coinbase,"Buy, sell, and manage cryptocurrencies.",39,https://bookface-images.s3.amazonaws.com/small_logos/1169cb0b69fa7b338b5d51c2d3805f8f988bdfa5.png,,,,,6
Airbnb,Winter 2009,"Consumer, Travel, Leisure and Tourism","Airbnb San Francisco, CA",TRUE,http://airbnb.com,https://www.ycombinator.com/companies/airbnb,Book accommodations around the world.,37,https://bookface-images.s3.amazonaws.com/small_logos/3e9a0092bee2ccf926e650e59c06503ec6b9ee65.png,,,,,6
Oklo,Summer 2014,"Industrials, Energy","Oklo Santa Clara, CA",TRUE,http://oklo.com,https://www.ycombinator.com/companies/oklo,"Emission free, always on power from advanced fission power plants.",66,https://bookface-images.s3.amazonaws.com/small_logos/7296c0e632938afdac098d754da89730bfc674b7.png,,,,,6
Rigetti Computing,Summer 2014,"Industrials, Manufacturing and Robotics","Rigetti Computing Berkeley, CA",TRUE,http://rigetti.com,https://www.ycombinator.com/companies/rigetti-computing,Quantum coherent supercomputing.,32,https://bookface-images.s3.amazonaws.com/small_logos/d917bc9763d052f49ea938f71c94205dabf1ec83.png,,,,,6
GitLab,Winter 2015,"B2B, Engineering, Product and Design",GitLab,TRUE,http://gitlab.com/,https://www.ycombinator.com/companies/gitlab,A complete DevOps platform delivered as a single application.,61,https://bookface-images.s3.amazonaws.com/small_logos/af0d32f65e9007b7edbde422787633e338fa9bff.png,,,,,6
Dropbox,Summer 2007,"B2B, Productivity","Dropbox San Francisco, CA",TRUE,http://dropbox.com,https://www.ycombinator.com/companies/dropbox,Backup and share files in the cloud.,36,https://bookface-images.s3.amazonaws.com/small_logos/f09464ae6ddf165ef871115af711c89d6530057f.png,,,,,6
BillionToOne,Summer 2017,"Healthcare, Diagnostics","Menlo Park, CA",TRUE,https://www.billiontoone.com,https://www.ycombinator.com/companies/billiontoone,The genetic testing platform detecting and measuring disease.,61,https://bookface-images.s3.amazonaws.com/small_logos/7374f48e30f2dabadb3413903af69fcda589d67f.png,,,,,6
Matterport,Winter 2012,"Consumer, Virtual and Augmented Reality","Matterport Sunnyvale, CA",TRUE,http://matterport.com,https://www.ycombinator.com/companies/matterport,Turn physical objects and environments into 3D models in seconds.,65,https://bookface-images.s3.amazonaws.com/small_logos/b271a79c3b59d6344c90e2803525a22f2a5e8406.png,,,,,6
PagerDuty,Summer 2010,"B2B, Engineering, Product and Design",PagerDuty,TRUE,http://pagerduty.com,https://www.ycombinator.com/companies/pagerduty,Real-time visibility into critical apps and services all in one place.,70,https://bookface-images.s3.amazonaws.com/small_logos/18fd6f870541d2398827dedc9e57678e8770c424.png,,,,,6
Amplitude,Winter 2012,"B2B, Analytics","Amplitude San Francisco, CA",TRUE,https://amplitude.com,https://www.ycombinator.com/companies/amplitude,Digital Analytics Platform,26,https://bookface-images.s3.amazonaws.com/small_logos/fa98c8a53255b3fd2e9d4a65dbb47eec293729f1.png,,,,,6
Ginkgo Bioworks,Summer 2014,"Healthcare, Industrial Bio","Ginkgo Bioworks Boston, MA",TRUE,http://ginkgobioworks.com,https://www.ycombinator.com/companies/ginkgo-bioworks,Our mission is to make biology easier to engineer.,50,https://bookface-images.s3.amazonaws.com/small_logos/d8427e9e647b115fc9f1f760c7a1324f1d2c02ef.png,,,,,6
Weave,Winter 2014,"B2B, Office Management","Weave Lehi, UT",TRUE,http://getweave.com,https://www.ycombinator.com/companies/weave,Customer communication and payments platform.,45,https://bookface-images.s3.amazonaws.com/small_logos/5d33fe7ddb69049aa965ac936b584f1efc32afd2.png,,,,,6
Pardes Biosciences,Summer 2020,"Healthcare, Drug Discovery and Delivery","Pardes Biosciences San Francisco, CA",TRUE,http://www.pardesbio.com,https://www.ycombinator.com/companies/pardes-bio,We break viruses,16,https://bookface-images.s3.amazonaws.com/small_logos/7a90b132bd3ef57761690e68c3355e7471e2abf7.png,,,,,6
Embark Trucks,Winter 2016,"Industrials, Automotive","Embark Trucks San Francisco, CA",TRUE,http://embarktrucks.com,https://www.ycombinator.com/companies/embark-trucks,Self-driving semi trucks.,25,https://bookface-images.s3.amazonaws.com/small_logos/7f54038f84e639bce5c45d1756018b94f17f6125.png,,,,,6
Momentus,Summer 2018,"Industrials, Aviation and Space","Momentus Santa Clara, CA",TRUE,https://momentus.space,https://www.ycombinator.com/companies/momentus,The space infrastructure services company,41,https://bookface-images.s3.amazonaws.com/small_logos/a9e04d61888abfae102ae9245cd5325c24e4bef5.png,,,,,6
Lucira Health,Winter 2015,"Healthcare, Diagnostics","Lucira Health Emeryville, CA",TRUE,https://www.lucirahealth.com/,https://www.ycombinator.com/companies/lucira-health,Next generation infectious disease test kits,44,https://bookface-images.s3.amazonaws.com/small_logos/c16f624e7c7aac96877a792583de496fc66b4a02.png,,,,,6
Segment,Summer 2011,"B2B, Analytics","Segment San Francisco, CA",TRUE,http://segment.com,https://www.ycombinator.com/companies/segment,"Software and APIs to collect, clean, and control customer data.",63,https://bookface-images.s3.amazonaws.com/small_logos/99f5abd1f15fa4ca4394b5781c98d8ff23db6f7b.png,,,,,6
Truebill,Winter 2016,"Fintech, Consumer Finance","Truebill Silver Spring, MD",TRUE,https://www.truebill.com,https://www.ycombinator.com/companies/truebill,Live your best financial life,29,https://bookface-images.s3.amazonaws.com/small_logos/fae52e07d79df342dcfc28d120038d2083ae0679.png,,,,,6
Twitch,Winter 2007,"Consumer, Content","Twitch San Francisco, CA",TRUE,http://twitch.com,https://www.ycombinator.com/companies/twitch,A global community creating the future of live entertainment.,61,https://bookface-images.s3.amazonaws.com/small_logos/d0e24465d91469fa05da337659e25131f5295e3d.png,,,,,6
PlanGrid,Winter 2012,"Real Estate and Construction, Construction",PlanGrid,TRUE,http://plangrid.com,https://www.ycombinator.com/companies/plangrid,Mobile applications for the construction industry.,50,https://bookface-images.s3.amazonaws.com/small_logos/33ee27aa9c6b3036b40ec6c7f0c2a98ccaf32f40.png,,,,,6
Bellabeat,Winter 2014,"Consumer, Consumer Electronics","Bellabeat San Francisco, CA",TRUE,http://bellabeat.com,https://www.ycombinator.com/companies/bellabeat,Tech-powered women's wellness.,30,https://bookface-images.s3.amazonaws.com/small_logos/ed160215b7a30dc30384bfcf6e726bac65688aff.png,,,,,6
Cruise,Winter 2014,"Industrials, Automotive","Cruise San Francisco, CA",TRUE,http://getcruise.com,https://www.ycombinator.com/companies/cruise,Self-driving cars.,18,https://bookface-images.s3.amazonaws.com/small_logos/b9aae9ad065dcf8b7a07d47b45a0667c6953810b.png,,,,,6
The Athletic,Summer 2016,"Consumer, Content","The Athletic San Francisco, CA",TRUE,https://theathletic.com,https://www.ycombinator.com/companies/the-athletic,Subscription sports media.,26,https://bookface-images.s3.amazonaws.com/small_logos/7f6b19c9a7bb7ba979f8935bcd2e5bd32b954069.png,,,,,6
Codecademy,Summer 2011,Education,"Codecademy New York, NY",TRUE,http://codecademy.com,https://www.ycombinator.com/companies/codecademy,The leading online learning platform for technical skills.,58,https://bookface-images.s3.amazonaws.com/small_logos/ee26c3b11a260e7a045f68b47d8c804b306db89f.png,,,,,6
Lever,Summer 2012,"B2B, Recruiting and Talent","Lever San Francisco, CA",TRUE,https://www.lever.co/,https://www.ycombinator.com/companies/lever,Talent Acquisition Suite that combines ATS + Talent CRM,55,https://bookface-images.s3.amazonaws.com/small_logos/5aab29bbd372c8ae56867cfafbca2d5d2ae180e6.png,,,,,6
Sendwave,Winter 2012,"Fintech, Payments","Sendwave Boston, MA",TRUE,https://www.sendwave.com,https://www.ycombinator.com/companies/sendwave,"Instant, no fee international remittances.",42,https://bookface-images.s3.amazonaws.com/small_logos/1bbfeae646cc8051b5ad469413e67295e9fae353.png,,,,,6
Deel,Winter 2019,"B2B, Finance and Accounting","Deel San Francisco, CA",TRUE,https://www.deel.com/,https://www.ycombinator.com/companies/deel,The all-in-one HR and payroll platform for global teams,55,https://bookface-images.s3.amazonaws.com/small_logos/2b5c8a17f0ab4fa9a72447d94bc3194dc17fce9b.png,,,,,6
Clever,Summer 2012,Education,"Clever San Francisco, CA",TRUE,https://clever.com,https://www.ycombinator.com/companies/clever,The platform that powers technology in the classroom.,53,https://bookface-images.s3.amazonaws.com/small_logos/76cc0d8c3947ddc3bc0b8b889117b3cf3dc00ba2.png,,,,,6
Caper,Winter 2016,"B2B, Retail",Caper Plug,TRUE,https://www.caper.ai/,https://www.ycombinator.com/companies/caper,Plug-and-play cashier-less retail powered by computer vision and AI,67,https://bookface-images.s3.amazonaws.com/small_logos/45034c22d81491a4e49c2c46c3c822d2d820941d.png,,,,,6
Reddit,Summer 2005,"Consumer, Content","Reddit San Francisco, CA",TRUE,http://reddit.com,https://www.ycombinator.com/companies/reddit,The frontpage of the internet.,30,https://bookface-images.s3.amazonaws.com/small_logos/2f5bed7ab9abb66ee8ccbf622c27a9d741c3c4e4.png,,,,,6
Fivestars,Winter 2011,"B2B, Retail","Fivestars San Francisco, CA",TRUE,http://fivestars.com,https://www.ycombinator.com/companies/fivestars,Customer loyalty and payments platform for small businesses.,60,https://bookface-images.s3.amazonaws.com/small_logos/e57fe3f2f5b8a158002acd8fef99c01e7294b55c.png,,,,,6
Optimizely,Winter 2010,"B2B, Engineering, Product and Design","Optimizely San Francisco, CA",TRUE,http://optimizely.com,https://www.ycombinator.com/companies/optimizely,The first all-in-one operating system for marketing,51,https://bookface-images.s3.amazonaws.com/small_logos/0d8d48fc3d7aa043a1e1d86d30f84a388f342454.png,,,,,6
WePay,Summer 2009,"Fintech, Payments",WePay,TRUE,http://wepay.com,https://www.ycombinator.com/companies/wepay,Payments for platform businesses.,33,https://bookface-images.s3.amazonaws.com/small_logos/5bafed02435325734c5fec395dabe88c19ce051c.png,,,,,6
Weebly,Winter 2007,"B2B, Marketing","Weebly San Francisco, CA",TRUE,http://weebly.com,https://www.ycombinator.com/companies/weebly,Build a free website that grows with your business.,51,https://bookface-images.s3.amazonaws.com/small_logos/1f9ac2ce5b5a93035fbbf9775d29c02d9a37dd6f.png,,,,,6
Flock Safety,Summer 2017,"B2B, Engineering, Product and Design","Flock Safety Atlanta, GA",TRUE,http://www.flocksafety.com,https://www.ycombinator.com/companies/flock-safety,The first public safety operating system that eliminates crime.,63,https://bookface-images.s3.amazonaws.com/small_logos/ee69b5c905088288ff0fc007921dde14514a40a1.png,,,,,6
Sqreen,Winter 2018,"B2B, Security","Sqreen San Francisco, CA",TRUE,https://www.sqreen.com/,https://www.ycombinator.com/companies/sqreen,Sqreen is the application security platform for the modern enterprise,69,https://bookface-images.s3.amazonaws.com/small_logos/9d891f44fe59b3c6d5bbb6ce15c0d60af544b9b8.png,,,,,6
NURX,Winter 2016,"Healthcare, Consumer Health and Wellness","New York, NY",TRUE,https://www.nurx.com/,https://www.ycombinator.com/companies/nurx,"Medicine or testing kit, prescribed online and delivered to your door.",70,https://bookface-images.s3.amazonaws.com/small_logos/e30eef55b4ffb18884d227d20476b264b3388dd6.png,,,,,6
CoreOS,Summer 2013,"B2B, Infrastructure",CoreOS,TRUE,http://coreos.com,https://www.ycombinator.com/companies/coreos,Open source tools of modern distributed systems.,48,https://bookface-images.s3.amazonaws.com/small_logos/0f9ad52c13f8ee67948f0995334dcaff8673134d.png,,,,,6
Bear Flag Robotics,Winter 2018,"Industrials, Agriculture","Bear Flag Robotics Newark, CA",TRUE,http://bearflagrobotics.com/,https://www.ycombinator.com/companies/bear-flag-robotics,Autonomous driving technology for farm tractors.,48,https://bookface-images.s3.amazonaws.com/small_logos/f6c760103131e6cfdd881aff2d03fe079d21ff37.png,,,,,6
Heroku,Winter 2008,"B2B, Infrastructure","Heroku San Francisco, CA",TRUE,http://heroku.com,https://www.ycombinator.com/companies/heroku,Enabling developers to build and run applications in the cloud.,63,https://bookface-images.s3.amazonaws.com/small_logos/ccf274d8a6c429ccf311e735490c66dee76ccace.png,,,,,6
GrubMarket,Winter 2015,"B2B, Supply Chain and Logistics",GrubMarket,TRUE,http://grubmarket.com,https://www.ycombinator.com/companies/grubmarket,AI-powered technology enabler and digital transformer of American…,66,https://bookface-images.s3.amazonaws.com/small_logos/a10cd6dd027a6f9927f0c0574be6404d3ed0c014.png,,,,,6
HelloSign,Winter 2011,"B2B, Productivity",HelloSign,TRUE,https://www.hellosign.com,https://www.ycombinator.com/companies/hellosign,eSignature software for small and mid-market businesses.,56,https://bookface-images.s3.amazonaws.com/small_logos/251df7a6d1d16ee11aac63b910791aca861aff29.png,,,,,6
Zenefits,Winter 2013,"B2B, Human Resources","Zenefits San Francisco, CA",TRUE,http://zenefits.com,https://www.ycombinator.com/companies/zenefits,"HR for small businesses: onboarding, payroll and benefits.",58,https://bookface-images.s3.amazonaws.com/small_logos/73b18a9d2bccc67389f1f2004f80ff39d7f3f27e.png,,,,,6
Honeylove,Summer 2018,"Consumer, Apparel and Cosmetics","Honeylove Los Angeles, CA",TRUE,https://www.honeylove.com,https://www.ycombinator.com/companies/honeylove,Honeylove makes functional undergarments for women,50,https://bookface-images.s3.amazonaws.com/small_logos/50726ec2a923dcdbc1976fc34ca5ae61e74a8d58.png,,,,,6
Modern Fertility,Summer 2017,"Healthcare, Consumer Health and Wellness","Modern Fertility San Francisco, CA",TRUE,https://www.modernfertility.com,https://www.ycombinator.com/companies/modern-fertility,At-home fertility test for women who aren't ready for kids right now…,69,https://bookface-images.s3.amazonaws.com/small_logos/b80c9ee16644141e27cf06459324dccdc7fd94bf.png,,,,,6
